{
  "formatVersion": 1,
  "stackIntents": [
    "implement",
    "plan",
    "investigate",
    "review",
    "verify"
  ],
  "extensions": {
    ".js": "javascript",
    ".jsx": "javascript",
    ".mjs": "javascript",
    ".cjs": "javascript",
    ".ts": "typescript",
    ".tsx": "typescript",
    ".py": "python",
    ".java": "java",
    ".kt": "kotlin",
    ".kts": "kotlin",
    ".cs": "csharp",
    ".go": "go"
  },
  "runtimeImplications": {
    "java": "jvm",
    "kotlin": "jvm",
    "jvm": "jvm"
  },
  "entries": [
    {
      "id": "workflow:implement",
      "skills": [
        "craft-delivery:apply-change"
      ],
      "references": [],
      "when": {
        "intents": [
          "implement"
        ]
      },
      "value": {
        "problem": "Unbounded implementation can miss the requested outcome or verification.",
        "contribution": "Sequence scope, evidence, focused edits and criterion-mapped checks.",
        "inputs": "Authorized request, project instructions, affected code and checks.",
        "result": "Focused change with observed verification and limitations.",
        "boundaries": "Use only for the affected behavior and matched selectors; selection grants no additional authorization.",
        "consumer": "Explicit user workflow or composed delivery flow.",
        "evidence": "Paired model task outcomes remain pending; deterministic fixtures verify selection only."
      }
    },
    {
      "id": "workflow:plan",
      "skills": [
        "craft-delivery:plan-change"
      ],
      "references": [
        "craft-engineering:foundations/references/design-principles.md"
      ],
      "when": {
        "intents": [
          "plan"
        ]
      },
      "value": {
        "problem": "Substantial work starts before boundaries, decisions and checks are understood.",
        "contribution": "Produce executable steps with alternatives, uncertainty and verification.",
        "inputs": "Request, acceptance criteria, constraints and repository evidence.",
        "result": "Cited plan with risks, ordered steps and unresolved choices.",
        "boundaries": "Use only for the affected behavior and matched selectors; selection grants no additional authorization.",
        "consumer": "Explicit user workflow or composed delivery flow.",
        "evidence": "Paired model task outcomes remain pending; deterministic fixtures verify selection only."
      }
    },
    {
      "id": "workflow:investigate",
      "skills": [
        "craft-delivery:inspect-architecture"
      ],
      "references": [],
      "when": {
        "intents": [
          "investigate"
        ]
      },
      "value": {
        "problem": "Architecture or ownership assumptions can misdirect a change.",
        "contribution": "Trace source and decision status before recommending work.",
        "inputs": "Question, affected paths and available project sources.",
        "result": "Grounded explanation with ownership, constraints and missing evidence.",
        "boundaries": "Use only for the affected behavior and matched selectors; selection grants no additional authorization.",
        "consumer": "Explicit user workflow or composed delivery flow.",
        "evidence": "Paired model task outcomes remain pending; deterministic fixtures verify selection only."
      }
    },
    {
      "id": "workflow:locate",
      "skills": [
        "craft-engineering:locate-code"
      ],
      "references": [],
      "when": {
        "intents": [
          "locate"
        ]
      },
      "value": {
        "problem": "Repository lookup can waste model context through repeated tiny searches or unsupported absence claims.",
        "contribution": "Select bounded batched evidence lookup and optional authorized extraction without loading implementation disciplines.",
        "inputs": "Explicit repository question, affected paths, search terms and coverage limits.",
        "result": "Compact cited evidence with searched scope, truncation and unresolved ambiguity.",
        "boundaries": "Deterministic lookup remains the default; selection neither launches a worker nor grants new authorization.",
        "consumer": "Locate intent and bounded repository evidence gathering.",
        "evidence": "Routing tests establish minimal selection only; model cost and latency require observed execution evidence."
      }
    },
    {
      "id": "workflow:research",
      "skills": [
        "craft-delivery:inspect-architecture"
      ],
      "references": [],
      "when": {
        "intents": [
          "research"
        ]
      },
      "value": {
        "problem": "Repository lookup can silently turn a proposal or inference into a fact.",
        "contribution": "Require cited local evidence and disclose unavailable sources.",
        "inputs": "Bounded repository question and accessible sources.",
        "result": "Relevant sources and decision status with explicit unknowns.",
        "boundaries": "Use only for the affected behavior and matched selectors; selection grants no additional authorization.",
        "consumer": "Explicit user workflow or composed delivery flow.",
        "evidence": "Paired model task outcomes remain pending; deterministic fixtures verify selection only."
      }
    },
    {
      "id": "workflow:review",
      "skills": [
        "craft-review:review-change"
      ],
      "fallbackSkills": {
        "craft-review:review-change": "craft-delivery:review-code"
      },
      "references": [],
      "when": {
        "intents": [
          "review"
        ]
      },
      "value": {
        "problem": "Findings can refer to a stale or unidentified revision.",
        "contribution": "Bind findings and verification limits to immutable review input.",
        "inputs": "Authorized review scope and base/head snapshot.",
        "result": "Evidence-backed findings and snapshot provenance.",
        "boundaries": "Use only for the affected behavior and matched selectors; selection grants no additional authorization.",
        "consumer": "Explicit user workflow or composed delivery flow.",
        "evidence": "Paired model task outcomes remain pending; deterministic fixtures verify selection only."
      }
    },
    {
      "id": "workflow:story",
      "skills": [
        "craft-stories:write-stories"
      ],
      "references": [],
      "when": {
        "intents": [
          "story"
        ]
      },
      "value": {
        "problem": "Task authoring can invent requirements or require an unavailable tracker.",
        "contribution": "Ground local story criteria in source and expose unanswered questions.",
        "inputs": "Task text, accessible code and specification evidence.",
        "result": "Local story draft with checkable criteria and unknowns.",
        "boundaries": "Use only for the affected behavior and matched selectors; selection grants no additional authorization.",
        "consumer": "Explicit user workflow or composed delivery flow.",
        "evidence": "Paired model task outcomes remain pending; deterministic fixtures verify selection only."
      }
    },
    {
      "id": "workflow:verify",
      "skills": [
        "craft-engineering:workflow-verify-feature"
      ],
      "references": [],
      "when": {
        "intents": [
          "verify"
        ]
      },
      "value": {
        "problem": "Passing unrelated checks can be mistaken for proof of a change.",
        "contribution": "Orchestrate manual, existing-automation or explicitly requested test-code verification without selecting product implementation.",
        "inputs": "Acceptance criteria, affected code and actual check commands.",
        "result": "Criterion-mapped observed results and verification gaps.",
        "boundaries": "Use only for the affected behavior and matched selectors; selection grants no additional authorization.",
        "consumer": "Explicit user workflow or composed delivery flow.",
        "evidence": "Paired model task outcomes remain pending; deterministic fixtures verify selection only."
      }
    },
    {
      "id": "practice:foundations",
      "skills": [
        "craft-engineering:foundations"
      ],
      "references": [],
      "when": {
        "intents": [
          "implement",
          "review"
        ]
      },
      "value": {
        "problem": "Unnecessary structure and unrelated edits obscure the change.",
        "contribution": "Apply scope, boundary and context discipline before adding code.",
        "inputs": "Affected code, user scope and applicable project policy.",
        "result": "Coherent implementation or review with justified structure.",
        "boundaries": "Use only for the affected behavior and matched selectors; selection grants no additional authorization.",
        "consumer": "Workflow entry points and host loading plans.",
        "evidence": "Paired model task outcomes remain pending; deterministic fixtures verify selection only."
      }
    },
    {
      "id": "practice:architecture",
      "skills": [
        "craft-delivery:inspect-architecture"
      ],
      "references": [],
      "when": {
        "intents": [
          "plan"
        ]
      },
      "value": {
        "problem": "Planning can rely on superseded or proposed architecture.",
        "contribution": "Distinguish accepted decisions, observed behavior and inference.",
        "inputs": "Decision sources, module declarations and affected paths.",
        "result": "Cited constraints, owners and surfaced discrepancies.",
        "boundaries": "Use only for the affected behavior and matched selectors; selection grants no additional authorization.",
        "consumer": "Workflow entry points and host loading plans.",
        "evidence": "Paired model task outcomes remain pending; deterministic fixtures verify selection only."
      }
    },
    {
      "id": "practice:task-grounding",
      "skills": [
        "craft-stories:ground-spec"
      ],